{
  "id": "11111111-1111-1111-1111-111111111111",
  "run_id": "22222222-2222-2222-2222-222222222222",
  "title": "SQL Injection in User Login Parameter",
  "severity": "CRITICAL",
  "cwe": "CWE-89",
  "target": "POST /api/v1/auth/login",
  "description": "Unsanitized user input concatenated directly into database query string.",
  "evidence_id": "33333333-3333-3333-3333-333333333333",
  "remediation": "Use parameterized queries or ORM query builder.",
  "created_at": "2026-10-02T16:07:00Z"
}
